{
  "kind": "aggregate",
  "name": "work-item",
  "slots": [
    {
      "name": "id",
      "required": true,
      "type": "string"
    },
    {
      "name": "title",
      "required": true,
      "type": "string"
    },
    {
      "name": "state",
      "required": true,
      "type": "string"
    }
  ],
  "source": {
    "dsl_file": "dsl/domain/work-item.lisp",
    "sha256": "85dac41ffb84398e04b9de7c7237bd83afd8195883f2bf51342bbbee8d11b91f"
  }
}
